Timestamp,Creator ID,Page,Result Number,Title,Aspect Ratio
1717114272,211064264,1,1,"Abstract podium for organic cosmetic products. Natural style, Marble podium with green moss on natural background, Copy space, generative ai",3:2
1717114272,211064264,1,2,"Asian beautiful woman in the field and admires the sunset, generative ai",16:9
1717114272,211064264,1,3,"Palm leaf shadows on green wall, Background for product advertisement, Summer tropical travel beach with minimal concept, Banner with copy space, generative ai",16:9
1717114272,211064264,1,4,"Abstract blue digital data background. Network connection structure. Structural connection of information. Data transfer in network connection. Data technology. Digital background, generative ai",16:9
1717114272,211064264,1,5,"Happy excited young woman with laptop at home sitting on a couch, received good news, got promotion, finished project, generative ai",16:9
1717114272,211064264,1,6,"Close up legs of mother walk in fall park with little child boy with dry yellow autumn leaves. Mother, small kid son feet on steps. Family day 15 of may love parents, children concept, generative ai",16:9
1717114272,211064264,1,7,"Close up beautiful cat sitting on the sofa at home with sunlight shining through the window, generative ai",16:9
1717114272,211064264,1,8,"Happy smiling relaxed young woman sitting on couch using mobile smartphone, looking at cellphone enjoying doing online ecommerce shopping in mobile apps or watching videos, generative ai",16:9
1717114272,211064264,1,9,"Group of American Football Fans Watching a Live Match Broadcast in a Sports Pub on TV, People Cheering, Supporting Their Team, generative ai",16:9
1717114272,211064264,1,10,"Cream podium for product display with clouds, smoke, fog, steam background, Beauty cosmetic product placement pedestal present stand minimal display, summer paradise dreamy concept generative ai",3:2
1717114272,211064264,1,11,"Happy excited young african american woman with laptop at home sitting on a couch, received good news, got promotion, finished project, generative ai",16:9
1717114272,211064264,1,12,"Cheerful young woman sitting on back seat of car while travelling. Young fun girl enjoying road trip. Traveling in car, generative ai",16:9
1717114272,211064264,1,13,"A colorful dark blue and green wooden board painted abstractly, Texture of a green and blue wooden planks, rustic style, generative ai",16:9
1717114272,211064264,1,14,"Happy cute dog wearing a party hat celebrating at a birthday party, surrounding by falling confetti, generative a",16:9
1717114272,211064264,1,15,"Tropical leaves Monstera and palm tree leaf. Flat lay, top view, generative ai",16:9
1717114272,211064264,1,16,"Smoker hand holding a smoking cigarette next to lungs full of smoke representing the danger of smoking for health, lung cancer and illness concept, World no tobacco day, generative ai",16:9
1717114272,211064264,1,17,"Location pin icon on earth city urban map indicating the location and direction, Yellow geopin. Geolocation map mark. Pin location pointer, Navigation icon, generative ai",16:9
1717114272,211064264,1,18,"Summer travel vacation concept, Happy traveler woman with hat relax in hammock on beach, generative ai",16:9
1717114272,211064264,1,19,"Businesswoman holding Light bulbs with Brain inside. Creative and innovation inspiration. Business Bright idea concept, generative ai",16:9
1717114272,211064264,1,20,"A dark empty street, dark blue background, an empty dark scene, neon light, spotlights The asphalt floor and studio room with smoke float up the interior texture. night view, generative ai",16:9
1717114272,211064264,1,21,"Piggy moneybox with falling gold coins on cream background. Concept of savings and accumulation, Pig money box with golden coins, generative ai",16:9
1717114272,211064264,1,22,"coffee beans on red background, generative ai",16:9
1717114272,211064264,1,23,"abstract grungy blue stucco wall background, generative ai",16:9
1717114272,211064264,1,24,"Rear view of university graduates wearing graduation gown and cap in the commencement day, Concept education congratulation. Graduation Ceremony, generative ai",16:9
1717114272,211064264,1,25,"Empty paper card mockup on a Green leaves, copy space, generative ai",16:9
1717114272,211064264,1,26,"Rear view of university graduates wearing graduation gown and cap in the commencement day, Concept education congratulation. Graduation Ceremony, generative ai",16:9
1717114272,211064264,1,27,Clean energy concept on World Environment Day or International Day of Forests concept tree and earth globe with solar cell panel with windmill on nature background. generative ai,16:9
1717114272,211064264,1,28,"White crumpled paper texture background, generative ai",16:9
1717114272,211064264,1,29,"Women carrying wooden box of salad vegetables produce in hydroponics greenhouse, generative ai",16:9
1717114272,211064264,1,30,"Wooden podium for natural products in mountains nature. A stage for cosmetics product presentation in natural green environment, copy space, generative ai",16:9
1717114272,211064264,1,31,"Customer satisfaction service concept, Hand holding wooden block with a smiley face icon to rate satisfaction, Satisfaction experience rating and service reviews, generative ai",16:9
1717114272,211064264,1,32,"Big Data concept. Digital neural network, Businesswoman hand touching Introduction of artificial intelligence, Cyberspace of future, Science and innovation of technology, generative ai",16:9
1717114272,211064264,1,33,"Podium for Cosmetic on pink background, Soap, Items Presentation. Abstract Minimal Geometric Sphere, Soft Shadow, Scene to Show Product, Object, generative ai",3:2
1717114272,211064264,1,34,"Palm leaf shadows on pink wall, Background for product advertisement, Summer tropical travel beach with minimal concept, Banner with copy space, generative ai",16:9
1717114272,211064264,1,35,"Blank podium stand with neon lights on dark background, generative ai",3:2
1717114272,211064264,1,36,"Natural brown wooden background, Wood texture surface with old natural pattern, generative ai",16:9
1717114272,211064264,1,37,Clean energy concept on World Environment Day or International Day of Forests concept tree and earth globe with solar cell panel with windmill on nature background. generative ai,16:9
1717114272,211064264,1,38,"Pink podium for product display with clouds, smoke, fog, steam background, Beauty cosmetic product placement pedestal present stand minimal display, summer paradise dreamy concept generative ai",16:9
1717114272,211064264,1,39,White crumpled paper texture background. generative ai,16:9
1717114272,211064264,1,40,"Brain inside of transparent light bulb placed on against yellow background, Brainstorming or knowledge. Creative idea of lamp, copy space, generative ai",16:9
1717114272,211064264,1,41,"Location pin icon on earth city urban map indicating the location and direction, Yellow geopin. Geolocation map mark. Pin location pointer, Navigation icon, generative ai",16:9
1717114272,211064264,1,42,"Globe ball with tree growing and green nature blur background, Eco concept, Saving environment, Save clean planet, Ecology concept, Card for world earth day, generative ai",16:9
1717114272,211064264,1,43,Clean energy concept on World Environment Day or International Day of Forests concept tree and earth globe with solar cell panel with windmill on nature background. generative ai,16:9
1717114272,211064264,1,44,"Close-up of children hands planting a tree in the soil, Planting young tree by kid hand on back soil as care and save wold concept, generative ai",16:9
1717114272,211064264,1,45,"Purple Glitter With Sparkle Of Lights And Stars, purple tone blur bokeh light, generative ai",16:9
1717114272,211064264,1,46,"Raising Hands for Participation, many people's hands up for support, generative ai",16:9
1717114272,211064264,1,47,"Empty wooden table with green park nature background, Wood table for food and product display over blur green tree garden, Park nature outdoor and wood table in spring and summer, generative ai",16:9
1717114272,211064264,1,48,"Concrete podium with a beige concrete wall and shadow background, Concrete texture background podium scene for products display, Concept display scene stage platform showcase, generative ai",16:9
1717114272,211064264,1,49,"Abstract podium for organic cosmetic products. Natural style, Marble podium with green moss on natural background, Copy space, generative ai",16:9
1717114272,211064264,1,50,"Palm leaf shadows on white wall, Background for product advertisement, Summer tropical travel beach with minimal concept, Banner with copy space, generative ai",16:9
1717114272,211064264,1,51,"Empty paper card mockup on a Green leaves, copy space, generative ai",16:9
1717114272,211064264,1,52,"Raising Hands for Participation, many people's hands up for support, generative ai",16:9
1717114272,211064264,1,53,"A dark empty street, dark blue background, an empty dark scene, neon light, spotlights The asphalt floor and studio room with smoke float up the interior texture. night view, generative ai",16:9
1717114272,211064264,1,54,"Heart shape made of coffee beans on redbackground. Flat lay. Symbol of Love to coffee, Roasted coffee beans arranged into shape of heart, generative ai",16:9
1717114272,211064264,1,55,"Hourglass as time passing concept for business, hourglass with shining light on dark background, generative ai",16:9
1717114272,211064264,1,56,"Closeup dust of metallic pigment sparkling with blue color, Abstract Blue bokeh defocus glitter blur background, generative ai",16:9
1717114272,211064264,1,57,"Closeup dust of metallic pigment sparkling with blue color, Abstract Blue bokeh defocus glitter blur background, generative ai",16:9
1717114272,211064264,1,58,"Rear view of university graduates wearing graduation gown and cap in the commencement day, Concept education congratulation. Graduation Ceremony, generative ai",16:9
1717114272,211064264,1,59,"Podium for Cosmetic on pink background, Soap, Items Presentation. Abstract Minimal Geometric Sphere, Soft Shadow, Scene to Show Product, Object, generative ai",3:2
1717114272,211064264,1,60,"Wooden podium for bathing and spa products in defocused bathroom, Round wooden podium for product display on blurred bathroom background, generative ai",16:9
1717114272,211064264,1,61,"Empty wooden table with green park nature background, Wood table for food and product display over blur green tree garden, Park nature outdoor and wood table in spring and summer, generative ai",16:9
1717114272,211064264,1,62,"Padlock with Keyhole in data security on Converging point of circuit. Cyber data and information privacy. Future technology security, Network protection, and Modern safety digital, generative ai",16:9
1717114272,211064264,1,63,"Glowing neon futuristic podium with Illuminated holographic display on a digital data stream background, Perfect for showcasing innovative and tech-savvy products, generative ai",16:9
1717114272,211064264,1,64,"Globe ball with tree growing and green nature blur background, Eco concept, Saving environment, Save clean planet, Ecology concept, Card for world earth day, generative ai",16:9
1717114272,211064264,1,65,"A dark empty street, dark blue background, an empty dark scene, neon light, spotlights The asphalt floor and studio room with smoke float up the interior texture. night view, generative ai",16:9
1717114272,211064264,1,66,"pink blue neon lines, geometric shapes, virtual space, ultraviolet light, 80's style, retro disco, fashion laser show, abstract background, generative ai",16:9
1717114272,211064264,1,67,"Woman plugging in the cable while charging the electric car at recharging service station, generative ai",16:9
1717114272,211064264,1,68,"Podium for Cosmetic on pink background, Soap, Items Presentation. Abstract Minimal Geometric Sphere, Soft Shadow, Scene to Show Product, Object, generative ai",16:9
1717114272,211064264,1,69,"Palm leaf shadows on pink wall, Background for product advertisement, Summer tropical travel beach with minimal concept, Banner with copy space, generative ai",16:9
1717114272,211064264,1,70,"Blurred business people walking in the office corridor. blurred business people at a trade fair, generative ai",16:9
1717114272,211064264,1,71,"Empty spacious meeting table for product display on blurred conference room background. Wooden table in the boardroom in corporate environment, Corporate room, generative ai",16:9
1717114272,211064264,1,72,"Location pin icon on earth city urban map indicating the location and direction, Red geopin. Geolocation map mark. Pin location pointer, Navigation icon, generative ai",16:9
1717114272,211064264,1,73,"Blue neon abstract background, ultraviolet light, night club empty room interior, tunnel or corridor, glowing panels, fashion podium, generative ai",16:9
1717114272,211064264,1,74,"Gold background, Textured wall painted with golden color, Gold concrete texture, generative ai",16:9
1717114272,211064264,1,75,"A dark empty street, dark blue background, an empty dark scene, neon light, spotlights The asphalt floor and studio room with smoke float up the interior texture. night view, generative ai",16:9
1717114272,211064264,1,76,"Businesswoman holding Light bulbs with Brain inside. Creative and innovation inspiration. Business Bright idea concept, generative ai",16:9
1717114272,211064264,1,77,"Rear view of university graduates wearing graduation gown and cap in the commencement day, Concept education congratulation. Graduation Ceremony, generative ai",16:9
1717114272,211064264,1,78,"Closeup dust of metallic pigment sparkling with blue color, Abstract Blue bokeh defocus glitter blur background, generative ai",16:9
1717114272,211064264,1,79,"https://contributor.stock.adobe.com/en/uploads/rejected#:Closeup of hands holding house, architecture, building, construction, real estate and property concept, generative ai",16:9
1717114272,211064264,1,80,"Women carrying wooden box of salad vegetables produce in hydroponics greenhouse, generative ai",16:9
1717114272,211064264,1,81,"Raising Hands for Participation, many people's hands up for support, generative ai",16:9
1717114272,211064264,1,82,"Wooden product podium with cherry blossom flowers on wooden background. Spring mockup template display, Round podium for cosmetic beauty product with cherry blossom flowers, generative ai",16:9
1717114272,211064264,1,83,"Palm leaf shadows on pink wall, Background for product advertisement, Summer tropical travel beach with minimal concept, Banner with copy space, generative ai",16:9
1717114272,211064264,1,84,"Palm leaf shadows on white wall, Background for product advertisement, Summer tropical travel beach with minimal concept, Banner with copy space, generative ai",16:9
1717114272,211064264,1,85,"Empty paper card mockup on a Green leaves, copy space, generative ai",16:9
1717114272,211064264,1,86,"Background of gradient blue color. Background of product studio with blue spotlight on Blue colour. Gradient background for poster banner and product advertising, generative ai",16:9
1717114272,211064264,1,87,"Woman plugging in the cable while charging the electric car at recharging service station, generative ai",16:9
1717114272,211064264,1,88,"Back view young tourist woman in summer dress and hat standing on beautiful sandy beach. Cute girl enjoy her tropical sea on relax holiday vacation during summer time and sunshine day, generative ai",16:9
1717114272,211064264,1,89,"Women carrying wooden box of salad vegetables produce in hydroponics greenhouse, generative ai",16:9
1717114272,211064264,1,90,"Rear view of university graduates wearing graduation gown and cap in the commencement day, Concept education congratulation. Graduation Ceremony, generative ai",16:9
1717114272,211064264,1,91,"Concrete podium with a beige concrete wall and shadow background, Concrete texture background podium scene for products display, Concept display scene stage platform showcase, generative ai",16:9
1717114272,211064264,1,92,"Woman holding elegant gift box for Mother's Day on wooden background, top view, generative ai",16:9
1717114272,211064264,1,93,"Empty wooden table with green park nature background, Wood table for food and product display over blur green tree garden, Park nature outdoor and wood table in spring and summer, generative ai",16:9
1717114272,211064264,1,94,"Digital handshake on blue technology background. Abstract two hands in lines, connected dots, and triangles, Business partnership concept, generative ai",16:9
1717114272,211064264,1,95,"Abstract futuristic cyberspace with binary code, matrix background with digits, Programming code abstract technology background of software developer and Computer script, generative ai",16:9
1717114272,211064264,1,96,"A colorful dark blue and green wooden board painted abstractly, Texture of a green and blue wooden planks, rustic style, generative ai",16:9
1717114272,211064264,1,97,"Raindrops on window glass. Rainy city background. Drops on glass, generative ai",16:9
1717114272,211064264,1,98,"Happy excited young woman with laptop at home sitting on a couch, received good news, got promotion, finished project, generative ai",16:9
1717114272,211064264,1,99,"Senior woman lifestyle at home with modern technology concept. Elder woman wearing virtual reality headset for therapy by metaverse tech online. Older relax on day play vr game, generative ai",16:9
1717114272,211064264,1,100,"Happy smiling relaxed young woman sitting on couch using mobile smartphone, looking at cellphone enjoying doing online ecommerce shopping in mobile apps or watching videos, generative ai",16:9
